{
  "schemaVersion": 1,
  "phase": "P33",
  "ledgerFile": "platform-p33-audit-ledger.jsonl",
  "ledgerPolicyVersion": "2026-10-03.1",
  "generatedAt": "2026-10-03T21:52:18.112063Z",
  "entryCount": 4,
  "headSequence": 3,
  "headEventId": "audit-capability-20261003T215218Z",
  "headHash": "492f07fb3e98c6099a36b456272fbc4329c6193d147da2d3ac4277e9748147d2",
  "ledgerSha256": "18bd930c200032f371a85eecf82f2b9878ecc1d9a3ec60b9fba7c4ffc185b520",
  "sourceMainSha": "0e7e48c57cc505ec0d42dcc706e364763b8e8c63",
  "hashAlgorithm": "SHA-256",
  "anchorPurpose": "Detect chain tampering and tail truncation when verified against reviewed Git history."
}
